,title,date,authority,link,desc
43,مصوبه شوراي عالي شهرسازي و معماري ايران در خصوص مغايرت اساسي طرح تفصيلي با طرح جامع شهرهاي داراب، فيروزآباد و آباده,1401/04/13,شوراي عالي شهرسازي و معماري ايران,https://qavanin.ir/Law/TreeText/299708,"مصوبه شوراي عالي شهرسازي و معماري ايران در خصوص مغايرت اساسي طرح تفصيلي با طرح جامع شهرهاي داراب، فيروزآباد و آباده مصوب 1401,04,13 با اصلاحات و الحاقات بعدي شوراي عالي شهرسازي و معماري ايران در جلسه مورخ 13 /4 /1401 مغايرت اساسي طرح تفصيلي با طرح جامع شهرهاي داراب، فيروزآباد و آباده ـ موضوع الحاق اراضي دولتي به مساحت ۱۲۵ هكتار به محدوده شهر داراب، ۱۹۵ هكتار به محدوده شهر فيروزآباد و ۸۷ هكتار به محدوده شهر آباده در اجراي قانون جهش توليد مسكن، مصوب مورخ 7 /12 /1400 شوراي برنامه‌ ريزي و توسعه استان فارس ـ را با عنايت به صورتجلسه مورخ 25 /3 /1401 كميته فني شماره يك مورد بررسي قرار داد و بشرح ذيل اتخاذ تصميم نمود: شهر داراب الحاق اراضي ۱۲۵هكتار واقع در شرق شهر مطابق با مصوبه شوراي برنامه‌ ريزي و توسعه استان مورد بررسي و با قيد اصلاحات زير مورد موافقت قرارگرفت و مقرر شد طرح آماده ‌سازي اراضي با توجه به جمعيت‌ پذيري ۱۸۵۰۰ نفر و تأمين سرانه‌ ها در مقياس شهر (مطابق با مصوبه تدقيق تعاريف و مفاهيم كاربري ‌هاي شهري و تعيين سرانه آنها مورخ 10 /3 /89 شوراي عالي ) با رعايت موارد اصلاحي به شرح زير به تصويب كميسيون ماده ۵ برسد: ۱ ـ عرصه‌ هاي جنوبي زمين با توجه به وجود عوارض ارتفاعي و غيرقابل بارگذاري بودن و همچنين تداخل با حريم و بستر مسيل اصلي مطابق نقشه پيوست از شمول اراضي الحاقي حذف گردد. ۲ ـ با عنايت به عبور بيش از ۱۷ آبراهه از زمين، ضمن تأكيد بر رعايت دقيق حريم و بستر آنها مطابق اعلام نظر آب منطقه ‌اي (نامه شماره 176 /222 /16 مورخ 30 /1 /1401 آب منطقه‌ اي) مقرر گرديد نقشه جمع ‌آوري و مديريت روان آبهاي سطحي همزمان با طرح تفكيكي اراضي تهيه و به تأييد شركت آب منطقه ‌اي استان فارس برسد. ۳ ـ ملاحظات احتمالي پدافندي بر اساس اعلام نظر اداره كل پدافند غيرعامل استانداري فارس در اسناد طرح منعكس شود. شهر فيروز آباد پيشنهاد الحاق ۱۹۵ هكتار واقع در شرق شهر (همجوار با مسكن مهر) مطابق با مصوبه شوراي برنامه‌ ريزي و توسعه استان (در طرفين شمال و جنوب كمربندي مصوب) مورد بررسي قرار گرفت و با عنايت به اين كه عبور اراضي الحاقي از كمر‌بندي عملاً منجر به اخلال جدي در كاركرد ترافيكي كمربندي خواهد شد، مقرر شد با بررسي و تأييد معاونت حمل و نقل وزارت راه و شهرسازي به هر ميزان كه امكان تدقيق مسير كمربندي و انتقال آن به پهنه‌ هاي شمالي فراهم بود، باقيمانده اراضي در سمت جنوب آن به محدوده شهر الحاق شود و طرح تفصيلي با تأمين حدود ۳۰۰۰ واحد مسكوني و سرانه‌ هاي خدماتي در مقياس شهر (مطابق با مصوبه تدقيق تعاريف و مفاهيم كاربري‌ هاي شهري و تعيين سرانه آنها مورخ 10 /3 /1389 شوراي عالي) با رعايت چهارچوب زير به تأييد كميسيون ماده ۵ برسد: ۱ ـ حريم مسيل‌ ها مندرج در نامه شماره 1335 /226 /16 مورخ 6 /11 /1400 آب منطقه‌ اي در طرح آماده‌ سازي اراضي لحاظ شود. ۲ ـ مسير كوچ رو موجود بر اساس اعلام نظر امور عشاير استانداري فارس از محدوده الحاقي حذف شود. ۳ ـ حريم كمربندي و حاشيه ۳۰ متر نوار تاسيساتي آن بر اساس نظر اداره كل راهداري استان از اراضي الحاقي حذف شود. ۴ ـ عرصه اثر ثبتي تنگه مهرك بر اساس استعلام از ميراث فرهنگي، صنايع دستي و گردشگري استان فارس در صورت تداخل با اراضي از محدوده شهر حذف شود، همچنين ضوابط حرايم اعلامي نيز در صورت تداخل با اراضي الحاقي ملاك اقدام قرار گيرد . ۵ ـ ملاحظات احتمالي پدافندي بر اساس اعلام نظر اداره كل پدافند غيرعامل استانداري فارس در اسناد طرح منعكس شود. شهر آباده درخواست الحاق حدود ۸۷ هكتار (در دو قطعه 4 /35 و ۵۲ هكتاري) واقع در غرب شهر و در مجاورت مسكن مهر و در مسير آباده به بهمن مطابق با مصوبه شوراي برنامه‌ ريزي و توسعه استان مورد بررسي قرارگرفت و ضمن موافقت با الحاق مقرر شد طرح تفصيلي اراضي با توجه به واحدپذيري ۱۱۳۰ واحد در اراضي ۳۵ هكتاري و ۲۰۰۰ واحد در اراضي۵۲ هكتاري با الگوي سكونت دو طبقه و با تأمين سرانه‌ ها در مقياس شهر (مطابق با مصوبه تدقيق تعاريف و مفاهيم كاربري‌ هاي شهري و تعيين سرانه آنها مورخ 10 /3 /89 شوراي عالي) با رعايت چهارچوب زير به تصويب كميسيون ماده ۵ برسد. ۱ ـ با توجه به وجود سه رشته قنات و يك مسيل در دو محدوده پيشنهادي، بر رعايت حرايم مربوطه مطابق نظر شركت آب منطقه ‌اي تأكيد مي‌ شود. 2 ـ در اراضي ۳۵ هكتاري واقع در شمال جاده آباده ـ بهمن، حريم و حاشيه ۳۰ متر نوار تاسيسات راه، مطابق با نظر اداره كل راهداري استان از محدوده الحاقي حذف شود. 3 ـ ملاحظات احتمالي پدافند غيرعامل بر اساس نظر اداره كل پدافند غيرعامل استانداري فارس در طرح منعكس و رعايت شود. مراتب جهت استحضار و صدور دستور انعكاس و اقدام اعلام مي‌ شود. معاون شهرسازي و معماري و دبير شوراي عالي شهرسازي و معماري ايران ـ فرزانه صادق ‌مالواجرد نقشه"
44,نظر مشورتي 7/1401/241 مورخ 1401/04/12 اداره كل حقوقي قوه قضائيه,1401/04/12,اداره کل حقوقی قوه قضائیه,https://qavanin.ir/Law/TreeText/300969,استعلام : مطابق ماده 576 قانون مجازات اسلامي مأموران دولتي و شهرداري‌ها مخاطب قرار گرفته و مجازات هم انفصال از خدمات دولتي است ولاغير. در ماده 496 قانون آيين دادرسي كيفري مصوب 1392 نيز صراحتا دستورات قاضي اجراي احكام كيفري را آورده و نه مدني و قابل ذكر هم هست اولا اشخاص احصاء شده در ماده 576 قانون مجازات اسلامي اخص از اشخاص مذكور در ماده 496 قانون آيين دادرسي كيفري است و ثانيا برخي از نظرات مشورتي آن اداره كل محترم ضمن تمايز ميان جلوگيري از اجراي احكام يا اوامر مقامات قضايي يا عدم اجراي دستور مقام قضايي (يا خودداري از اجراي آن) عنوان اخير را فاقد ضمانت اجراي كيفري دانسته‌اند. مع الوصف در مواردي كه حكم حقوقي قطعي مي‌شود و اجراي آن به مؤسسه خصوصي يا عمومي خصوصي مثل بانكهاي خصوصي كشور ابلاغ مي‌شود و آن مؤسسه خصوصي و بانك خصوصي آن را اجرا نمي‌كند دادگستري براي اجراي آن با چه ضمانت اجرايي مواجه است البته در يك مورد مشابه اينجانب با خلق راهكار مراتب را به بانك مركزي جمهوري اسلامي ايران منعكس و از مكانيزم نظارتي بانك مركزي بر بانكها استفاده نموده و حكم اجرا شد اما در موارد مشابه و امر مبتلا به عام به نظر صدور نظر مشورتي آن مرجع محترم راهگشاست. نظريه مشورتي اداره كل حقوقي قوه قضاييه : مؤسسات خصوصي و بانك‌هاي خصوصي و كاركنان آن‌ها از مصاديق اشخاص مذكور در ماده 576 قانون مجازات اسلامي (تعزيرات) 1375 و مواد 495 و 496 قانون آيين دادرسي كيفري 1392 نيستند و امتناع آن‌ها از اجراي دستورات مقام قضايي (اعم از حقوقي و كيفري) و يا تخطي آن‌ها از اين دستورات جرم‌انگاري نشده است و با عنايت به اصل قانوني بودن جرم و مجازات كه در ماده 2 قانون مجازات اسلامي 1392 نيز تصريح شده است؛ رفتار مذكور در استعلام فاقد وصف كيفري است و جرم محسوب نمي‌شود و چون اجراي احكام دادگاه‌هاي حقوقي مطابق مقررات قانون اجراي احكام مدني مصوب 1356 و قانون نحوه اجراي محكوميت‌هاي مالي مصوب 1394 صورت مي‌گيرد، (مواد 87 تا 95 قانون اجراي احكام مدني مصوب 1356) در خصوص نحوه استيفاي محكوم‌به از اموال محكوم‌عليه نزد شخص ثالث (كه بانك‌هاي خصوصي و موسسات خصوصي نيز شخص ثالث محسوب مي‌شوند) تعيين تكليف شده است و ضمانت اجراي مدني نيز در صورت تخطي شخص ثالث پيش‌‌بيني شده است، بديهي است كه در صورت تخلف بانك‌هاي خصوصي از اجراي قوانين، مقررات انتظامي مربوط به بانك‌ها و كاركنان آن حسب مورد قابل اجرا خواهد بود
45,بخشنامه گمرك در خصوص ساماندهي صادرات لوله و پروفيل,1401/04/12,گمرك ايران,https://qavanin.ir/Law/TreeText/298456,"بخشنامه گمرك در خصوص ساماندهي صادرات لوله و پروفيل مصوب 1401,04,12 با اصلاحات و الحاقات بعدي  با سلام، پيرو بخشنامه شماره 304933 /1401 /60 مورخ 07 /03 /1401 موضوع ساماندهي صادرات لوله و پروفيل، به پيوست تصوير نامه شماره 90599 /60 مورخ 07 /04 /1401 دفتر مقررات صادرات و واردات وزارت صنعت، معدن و تجارت منضم به نامه شماره 87179 /60 مورخ 04 /04 /1401 مديركل دفتر صنايع معدني وزارت صنعت، معدن و تجارت عيناً جهت اطلاع و اقدام لازم وفق مفاد نامه هاي مذكور (با مشخصات و كد طبقه بندي شده اعلامي شركت هاي مجاز به صادرات محصولات لوله و پروفيل) با رعايت كليه قوانين و مقررات و ضوابط مربوطه ارسال ميگردد. علي اكبر شاماني مديركل دفتر صادرات از طرف رضا صادق تصاوير در متن و تصوير قابل رويت است. تصوير نامه شماره 90599 /60 مورخ 07 /04 /1401 تصوير نامه شماره 87179 /60 مورخ 04 /04 /1401 جدول تصوير نامه شماره 87179 /60 مورخ 04 /04 /1401 جدول تصوير نامه شماره 87179 /60 مورخ 04 /04 /1401 جدول تصوير نامه شماره 87179 /60 مورخ 04 /04 /1401 جدول تصوير نامه شماره 87179 /60 مورخ 04 /04 /1401 جدول تصوير نامه شماره 87179 /60 مورخ 04 /04 /1401 جدول تصوير نامه شماره 87179 /60 مورخ 04 /04 /1401"
46,تعيين حق العمل خدمات جايگاه هاي سوخت با احتساب عوارض و ماليات بر ارزش افزوده در سال 1401,1401/04/12,هيات وزيران,https://qavanin.ir/Law/TreeText/298472,"تعيين حق العمل خدمات جايگاه هاي سوخت با احتساب عوارض و ماليات بر ارزش افزوده در سال 1401 مصوب 1401,04,12 با اصلاحات و الحاقات بعدي   هيئت وزيران در جلسه 12/ 4/ 1401 به پيشنهاد مشترك سازمان برنامه و بودجه كشـور و وزارت نفت و به استناد اصل يكصد و سي و هشتم قانون اساسي جمهوري اسلامي ايران و در اجراي بند (۱) جدول تبصره (۱۴) قانون بودجه سال ۱۴۰۱ كل كشور تصويب كرد: ۱- حق العمـل خـدمـات جـايگـاه هـاي سـوخـت بـا احتساب عوارض و ماليات بر ارزش افزوده در سال ۱۴۰۱، با اعمال چهل و پنج درصد (۴۵٪) افزايش نسبت به سال ۱۴۰۰، تعيين مي شـود. همچنين متوسط نرخ حق العمل جايگاه هاي گاز طبيي فشرده (CNG) در سال ۱۴۰۱ نسبت به سال ۱۴۰۰ (برحسب طبقه بندي) چهل و پنج درصد (۴۵٪) اضافه مي شود. مبالغ حق العمل جايگاه ها از محل فروش توسط جايگاه هاي عرضه سوخت برداشت مي شود. پرداخت عوارض و ماليات بر ارزش افزوده خـدمـات جـايـگـاه هـا بـه مـأخـذ ارزش خدمات آنها، بر عهده جايگاه هاي ياد شـده اســت و سازمان امور مالياتي كشور موظف است مبالغ را از طريق جايگاه هاي مذكور دريافت نمايد. ۲- وزارت نفت اجازه دارد افزايش هاي تعيين شده حق العمل سوخت مايع را بر اساس ميزان فروش جايگاه ها، به صورت پلكاني (حـداكثر سه پله) به نحوي تعيين نمايد كه ميانگين افزايش چهل و پنج درصد (۴۵٪) رعايت گردد. ۳- براي جبران حق العمـل جـايـگـاه هاي عرضه گاز طبيعي فشرده (CNG)، قيمت عرضـه هر مترمكعب گاز طبيعي فشرده (CNG) معادل پنج هزار و هفتصد (700/ 5) ريال تعيين مي گردد. 4- نرخ حق العمـل سـوخـت گيري هوايي در فرودگاه هايي كه راهبري سـوختگيري توسـط بخش غيردولتي انجام مي شود، توسط وزارت نفت پيشنهاد و به تأييد سازمان برنامه و بودجه كشور مي رسد. محمد مخبر معاون اول رييس جمهور"
47,تخصيص اعتبار به مبلغ پانصد ميليارد (000 /000 /000 /500) ريال به منظور جبران خسارت هاي ناشي از وقوع زلزله در استان هرمزگان به وزارت كشور,1401/04/12,هيات وزيران,https://qavanin.ir/Law/TreeText/298512,"تخصيص اعتبار به مبلغ پانصد ميليارد (000 /000 /000 /500) ريال به منظور جبران خسارت هاي ناشي از وقوع زلزله در استان هرمزگان به وزارت كشور مصوب 1401,04,12 با اصلاحات و الحاقات بعدي  هيئت وزيران در جلسه 12 /4 /1401 به پيشنهاد وزارت كشور و تأييد سازمان برنامه و بودجه كشور و به استناد اصل يكصد و سي و هشتم قانون اساسي جمهوري اسلامي ايران تصويب كرد: 1 - مبلغ پانصد ميليارد (000 /000 /000 /500) ريال به صورت هزينه اي و تملك دارايي سرمايه اي از محل منابع بند (م) ماده (28) قانون الحاق برخي مواد به قانون تنظيم بخشي از مقررات مالي دولت (2) – مصوب 1393-، به منظور جبران خسارت هاي ناشي از وقوع زلزله در استان هرمزگان در اختيار وزارت كشور قرار مي گيرد تا برابر قوانين و مقررات مربوط هزينه شود. 2 - وزارت كشور موظف است گزارش عملكرد اين تصويب نامه را در مقاطع زماني سه ماهه به سازمان هاي برنامه و بودجه كشور و مديريت بحران كشور ارسال نمايد. محمد مخبر معاون اول رييس جمهور"
48,نظر مشورتي 7/1401/191 مورخ 1401/04/11 اداره كل حقوقي قوه قضائيه,1401/04/11,اداره کل حقوقی قوه قضائیه,https://qavanin.ir/Law/TreeText/300907,استعلام : در صورتي كه دادگاه ملك توقيف‌شده را جزء مستثنيات دين تشخيص دهد و از ملك رفع توقيف به عمل آورد، آيا بعد از چند سال با توجه به وضعيت اقتصادي و تغيير ارزش ملك، محكوم‌له مي‌تواند مجدد ملك را توقيف كند و آيا دادگاه ملزم به تبعيت از دستور قبلي مبني بر مستثنيات بودن اين ملك است؟ نظريه مشورتي اداره كل حقوقي قوه قضاييه : با عنايت به بند «الف» ماده 24 قانون نحوه اجراي محكوميت‌هاي مالي مصوب 1394 و تبصره يك آن، منزل مسكوني محكوم‌عليه در صورتي جزء مستثنيات دين تلقي مي‌شود‌ كه اولاً، محل سكونت محكوم‌عليه باشد و ثانياً، منزل مسكوني در حد نياز و شأن عرفي محكوم‌عليه در حالت اعسارش باشد؛ بنابراين در فرض سؤال، هرچند صرف افزايش قيمت ملك ناشي از تورم نمي‌تواند موجب تغيير وضعيت مالي محكوم‌عليه تلقي شود؛ اما به طور كلي با توجه به تغيير ارزش، تشخيص مستثنيات يا عدم مستثنيات دين بودن منزل مسكوني و در نتيجه امكان توقيف مجدد ملك با توجه به وضعيت جديد با مرجع قضايي مربوط است و در اين خصوص دادگاه (مقام قضايي) ملزم به تبعيت از دستور قبلي نيست.
49,نظر مشورتي 7/1401/109 مورخ 1401/04/11 اداره كل حقوقي قوه قضائيه,1401/04/11,اداره کل حقوقی قوه قضائیه,https://qavanin.ir/Law/TreeText/300987,استعلام : چنانچه دو نفر متهم به مشاركت در ارتكاب جرم باشند و يكي از آنان ناشناخته بوده و وفق ماده ۱۰۴ قانون آيين دادرسي كيفري مصوب 1392 پرونده تحقيقي وي در دادسرا مفتوح بماند؛ اما در مورد ديگر متهم، پرونده با صدور كيفرخواست نزد دادگاه ارسال شود و دادگاه نيز حكم بر محكوميت صادر كند و پس از مدتي متهم دوم نيز شناسايي شود و در مورد او نيز كيفرخواست صادر و پرونده به شعبه ديگري از دادگاه كيفري ارجاع شود، با توجه به مختومه بودن پرونده شريك ديگر، آيا دادگاه مرجوع‌اليه بايد در اجراي ماده ۳۱۱ قانون آيين دادرسي كيفري مصوب 1392 پرونده را به شعبه‌اي كه قبلاً به اتهام شريك ديگر رسيدگي كرده است، ارسال كند؟ نظريه مشورتي اداره كل حقوقي قوه قضاييه : مقررات ماده 311 قانون آيين دادرسي كيفري مصوب 1392 در ضرورت رسيدگي به اتهامات شركا و معاونان جرم در مرجع قضايي (واحد) كه به اتهام متهم اصلي رسيدگي مي‌كند، ناظر به جايي است كه پرونده‌ در خصوص متهمان در جريان رسيدگي باشد؛ بنابراين در فرض سؤال كه رسيدگي به اتهام يكي از شركاي جرم در يك حوزه قضايي انجام و با صدور رأي پرونده مختومه شده است با لحاظ اين كه شعب مختلف دادگاه در يك حوزه قضايي، واحد محسوب مي‌شوند، الزام قانوني جهت ارسال پرونده از سوي دادگاه كيفري كه به اتهام شريك ديگر جرم رسيدگي مي‌كند به شعبه‌اي كه قبلاً به اتهام يكي از شركاي جرم رسيدگي كرده است نمي‌باشد و بايد به رسيدگي خود ادامه دهد؛ هرچند اصلح آن است كه پرونده امر به شعبه‌اي ارجاع شود كه داراي سبق رسيدگي است.
